{
  "cycle_id": "example-cycle",
  "ticket_title": "Example in-progress ticket",
  "findings": [],
  "qa_verification": [
    {
      "command": "cyclesmith validate -- --cycle-dir reports/dev_loop/example_cycle --validate-schema",
      "result": "pass",
      "evidence": "reference bundle validates"
    }
  ],
  "verdict": "pass",
  "ticket_transition": "REVIEW",
  "follow_up_tickets": [],
  "next_cycle_focus": "Continue with active repository ticket."
}
